[33m16a88f8[m[33m ([m[1;36mHEAD[m[33m -> [m[1;32mmain[m[33m, [m[1;31morigin/main[m[33m, [m[1;31morigin/HEAD[m[33m)[m HEAD@{0}: reset: moving to origin/main
[33mfa51cbc[m HEAD@{1}: commit: Remove large flight pings file from tracking
[33me526d16[m HEAD@{2}: commit: Automated update 2025-09-09 19-33
[33m7e5f516[m HEAD@{3}: reset: moving to HEAD
[33m7e5f516[m HEAD@{4}: commit: Flight Ping update 9/7/2025
[33md375a83[m HEAD@{5}: commit: Automated update 2025-09-09 18-00
[33meda2001[m HEAD@{6}: reset: moving to HEAD
[33meda2001[m HEAD@{7}: commit: Automated update 2025-09-09 12-00
[33m93de0f3[m HEAD@{8}: reset: moving to HEAD
[33m93de0f3[m HEAD@{9}: commit: Automated update 2025-09-09 6-00
[33mff95e14[m HEAD@{10}: reset: moving to HEAD
[33mff95e14[m HEAD@{11}: commit: Automated update 2025-09-09 0-00
[33mfca45c1[m HEAD@{12}: reset: moving to HEAD
[33mfca45c1[m HEAD@{13}: commit: Automated update 2025-09-08 18-00
[33me5286fe[m HEAD@{14}: reset: moving to HEAD
[33me5286fe[m HEAD@{15}: commit: Automated update 2025-09-08 12-00
[33mb3afb85[m HEAD@{16}: reset: moving to HEAD
[33mb3afb85[m HEAD@{17}: commit: Automated update 2025-09-08 6-00
[33m755c5a1[m HEAD@{18}: reset: moving to HEAD
[33m755c5a1[m HEAD@{19}: commit: Automated update 2025-09-08 0-00
[33m4659513[m HEAD@{20}: reset: moving to HEAD
[33m4659513[m HEAD@{21}: commit: Flight Ping update 9/7/2025
[33m00c584f[m HEAD@{22}: commit: Automated update 2025-09-07 18-00
[33m3a6b4bd[m HEAD@{23}: reset: moving to HEAD
[33m3a6b4bd[m HEAD@{24}: commit: Automated update 2025-09-07 12-00
[33m9fcf226[m HEAD@{25}: reset: moving to HEAD
[33m9fcf226[m HEAD@{26}: commit: Automated update 2025-09-07 6-00
[33mb5024bc[m HEAD@{27}: reset: moving to HEAD
[33mb5024bc[m HEAD@{28}: commit: Automated update 2025-09-07 0-00
[33m9b34214[m HEAD@{29}: reset: moving to HEAD
[33m9b34214[m HEAD@{30}: commit: Automated update 2025-09-06 18-00
[33m42f2a04[m HEAD@{31}: reset: moving to HEAD
[33m42f2a04[m HEAD@{32}: commit: Automated update 2025-09-06 12-00
[33m7a15f2c[m HEAD@{33}: reset: moving to HEAD
[33m7a15f2c[m HEAD@{34}: commit: Automated update 2025-09-06 6-00
[33mcc5304c[m HEAD@{35}: reset: moving to HEAD
[33mcc5304c[m HEAD@{36}: commit: Automated update 2025-09-06 0-00
[33m85e1780[m HEAD@{37}: reset: moving to HEAD
[33m85e1780[m HEAD@{38}: commit: Automated update 2025-09-05 18-00
[33ma7feec0[m HEAD@{39}: reset: moving to HEAD
[33ma7feec0[m HEAD@{40}: commit: Automated update 2025-09-05 12-00
[33mf3e79d1[m HEAD@{41}: reset: moving to HEAD
[33mf3e79d1[m HEAD@{42}: commit: Automated update 2025-09-05 6-00
[33mfbc55be[m HEAD@{43}: reset: moving to HEAD
[33mfbc55be[m HEAD@{44}: commit: Automated update 2025-09-05 0-00
[33m117d386[m HEAD@{45}: reset: moving to HEAD
[33m117d386[m HEAD@{46}: commit: Flight Ping update 9/4/2025
[33m6880369[m HEAD@{47}: commit: Automated update 2025-09-04 18-00
[33m4ecce04[m HEAD@{48}: reset: moving to HEAD
[33m4ecce04[m HEAD@{49}: commit: Automated update 2025-09-04 12-00
[33m15868a5[m HEAD@{50}: reset: moving to HEAD
[33m15868a5[m HEAD@{51}: commit: Automated update 2025-09-04 6-00
[33m95fe766[m HEAD@{52}: reset: moving to HEAD
[33m95fe766[m HEAD@{53}: commit: Automated update 2025-09-04 0-00
[33mdcc8cea[m HEAD@{54}: reset: moving to HEAD
[33mdcc8cea[m HEAD@{55}: commit: Automated update 2025-09-03 18-00
[33m72a78bb[m HEAD@{56}: reset: moving to HEAD
[33m72a78bb[m HEAD@{57}: commit: Automated update 2025-09-03 12-00
[33m9c16f6a[m HEAD@{58}: reset: moving to HEAD
[33m9c16f6a[m HEAD@{59}: commit: Automated update 2025-09-03 6-00
[33m2051aca[m HEAD@{60}: reset: moving to HEAD
[33m2051aca[m HEAD@{61}: commit: Flight Ping update 9/3/2025
[33m16a88f8[m[33m ([m[1;36mHEAD[m[33m -> [m[1;32mmain[m[33m, [m[1;31morigin/main[m[33m, [m[1;31morigin/HEAD[m[33m)[m HEAD@{62}: commit: Automated update 2025-09-03 0-00
[33m6bf8465[m HEAD@{63}: reset: moving to HEAD
[33m6bf8465[m HEAD@{64}: commit: Automated update 2025-09-02 18-00
[33m851f15d[m HEAD@{65}: reset: moving to HEAD
[33m851f15d[m HEAD@{66}: commit: Automated update 2025-09-02 12-00
[33m9c46a95[m HEAD@{67}: reset: moving to HEAD
[33m9c46a95[m HEAD@{68}: commit: Automated update 2025-09-02 6-00
[33m30fb26b[m HEAD@{69}: reset: moving to HEAD
[33m30fb26b[m HEAD@{70}: commit: Automated update 2025-09-02 0-00
[33mc9cf3bb[m HEAD@{71}: reset: moving to HEAD
[33mc9cf3bb[m HEAD@{72}: commit: Automated update 2025-09-01 18-00
[33m5555842[m HEAD@{73}: reset: moving to HEAD
[33m5555842[m HEAD@{74}: commit: Automated update 2025-09-01 12-00
[33m7eeaabf[m HEAD@{75}: reset: moving to HEAD
[33m7eeaabf[m HEAD@{76}: commit: Automated update 2025-09-01 6-00
[33m18bc886[m HEAD@{77}: reset: moving to HEAD
[33m18bc886[m HEAD@{78}: commit: Automated update 2025-09-01 0-00
[33md7257ba[m HEAD@{79}: reset: moving to HEAD
[33md7257ba[m HEAD@{80}: commit: Flight Ping update 8/31/2025
[33m203f490[m HEAD@{81}: commit: Automated update 2025-08-31 18-00
[33m14b1b3f[m HEAD@{82}: reset: moving to HEAD
[33m14b1b3f[m HEAD@{83}: commit: Automated update 2025-08-31 12-00
[33ma97efb9[m HEAD@{84}: reset: moving to HEAD
[33ma97efb9[m HEAD@{85}: commit: Automated update 2025-08-31 6-00
[33m7ba7f72[m HEAD@{86}: reset: moving to HEAD
[33m7ba7f72[m HEAD@{87}: commit: Automated update 2025-08-31 0-00
[33m9eb789f[m HEAD@{88}: reset: moving to HEAD
[33m9eb789f[m HEAD@{89}: commit: Automated update 2025-08-30 18-00
[33md399001[m HEAD@{90}: reset: moving to HEAD
[33md399001[m HEAD@{91}: commit: Automated update 2025-08-30 12-00
[33m7272385[m HEAD@{92}: reset: moving to HEAD
[33m7272385[m HEAD@{93}: commit: Flight Ping update 8/30/2025
[33md68b24e[m HEAD@{94}: commit: Flight Ping update 8/30/2025
[33m2601248[m HEAD@{95}: commit: Automated update 2025-08-30 6-00
[33m5f74529[m HEAD@{96}: reset: moving to HEAD
[33m5f74529[m HEAD@{97}: commit: Automated update 2025-08-30 0-00
[33m7b6486c[m HEAD@{98}: reset: moving to HEAD
[33m7b6486c[m HEAD@{99}: commit: Automated update 2025-08-29 18-00
[33m0854108[m HEAD@{100}: reset: moving to HEAD
[33m0854108[m HEAD@{101}: commit: Automated update 2025-08-29 12-00
[33mb941a3d[m HEAD@{102}: reset: moving to HEAD
[33mb941a3d[m HEAD@{103}: commit: Automated update 2025-08-29 6-00
[33m5c6e57e[m HEAD@{104}: reset: moving to HEAD
[33m5c6e57e[m HEAD@{105}: commit: Automated update 2025-08-29 0-00
[33mb76d14d[m HEAD@{106}: reset: moving to HEAD
[33mb76d14d[m HEAD@{107}: commit: Automated update 2025-08-28 18-00
[33mc622b78[m HEAD@{108}: reset: moving to HEAD
[33mc622b78[m HEAD@{109}: commit: Automated update 2025-08-28 12-00
[33m6674781[m HEAD@{110}: reset: moving to HEAD
[33m6674781[m HEAD@{111}: commit: Automated update 2025-08-28 6-00
[33m83b1641[m HEAD@{112}: reset: moving to HEAD
[33m83b1641[m HEAD@{113}: commit: Automated update 2025-08-28 0-00
[33m4c69d1d[m HEAD@{114}: reset: moving to HEAD
[33m4c69d1d[m HEAD@{115}: commit: Automated update 2025-08-27 18-00
[33mc9f461b[m HEAD@{116}: reset: moving to HEAD
[33mc9f461b[m HEAD@{117}: commit: Flight Ping update 8/27/2025
[33m2ce2d0c[m HEAD@{118}: commit: Automated update 2025-08-27 12-00
[33m3aba120[m HEAD@{119}: reset: moving to HEAD
[33m3aba120[m HEAD@{120}: commit: Automated update 2025-08-27 6-00
[33m7ec0cd4[m HEAD@{121}: reset: moving to HEAD
[33m7ec0cd4[m HEAD@{122}: commit: Flight Ping update 8/27/2025
[33m86ee549[m HEAD@{123}: commit: Automated update 2025-08-27 0-00
[33mc08d522[m HEAD@{124}: reset: moving to HEAD
[33mc08d522[m HEAD@{125}: commit: Automated update 2025-08-26 18-00
[33m82ef0ba[m HEAD@{126}: reset: moving to HEAD
[33m82ef0ba[m HEAD@{127}: commit: Automated update 2025-08-26 12-00
[33m27fdc50[m HEAD@{128}: reset: moving to HEAD
[33m27fdc50[m HEAD@{129}: commit: Automated update 2025-08-26 6-00
[33m4a413a1[m HEAD@{130}: reset: moving to HEAD
[33m4a413a1[m HEAD@{131}: commit: Automated update 2025-08-26 0-00
[33m8acbd2d[m HEAD@{132}: reset: moving to HEAD
[33m8acbd2d[m HEAD@{133}: commit: Automated update 2025-08-25 18-00
[33mbacb04d[m HEAD@{134}: reset: moving to HEAD
[33mbacb04d[m HEAD@{135}: commit: Automated update 2025-08-25 12-00
[33m5114e72[m HEAD@{136}: reset: moving to HEAD
[33m5114e72[m HEAD@{137}: commit: Flight Ping update 8/25/2025
[33m0d21795[m HEAD@{138}: commit: Automated update 2025-08-25 6-00
[33m6bcc979[m HEAD@{139}: reset: moving to HEAD
[33m6bcc979[m HEAD@{140}: commit: Automated update 2025-08-25 0-00
[33m6a3e4e7[m HEAD@{141}: reset: moving to HEAD
[33m6a3e4e7[m HEAD@{142}: commit: Automated update 2025-08-24 18-00
[33maed0972[m HEAD@{143}: reset: moving to HEAD
[33maed0972[m HEAD@{144}: commit: Automated update 2025-08-24 12-00
[33m251194b[m HEAD@{145}: reset: moving to HEAD
[33m251194b[m HEAD@{146}: commit: Automated update 2025-08-24 6-00
[33m2267c15[m HEAD@{147}: reset: moving to HEAD
[33m2267c15[m HEAD@{148}: commit: Automated update 2025-08-24 0-00
[33m508c379[m HEAD@{149}: reset: moving to HEAD
[33m508c379[m HEAD@{150}: commit: Automated update 2025-08-23 18-00
[33m0ad2f8b[m HEAD@{151}: reset: moving to HEAD
[33m0ad2f8b[m HEAD@{152}: commit: Automated update 2025-08-23 14-03
[33md92793e[m HEAD@{153}: reset: moving to HEAD
[33md92793e[m HEAD@{154}: commit: Automated update 2025-08-23 13-57
[33m1593665[m HEAD@{155}: reset: moving to HEAD
[33m1593665[m HEAD@{156}: commit: Flight Ping update 8/23/2025
[33m4694857[m HEAD@{157}: commit: Automated update 2025-08-23 0-00
[33ma2107a1[m HEAD@{158}: reset: moving to HEAD
[33ma2107a1[m HEAD@{159}: commit: Automated update 2025-08-22 18-00
[33m4559cac[m HEAD@{160}: reset: moving to HEAD
[33m4559cac[m HEAD@{161}: commit: Automated update 2025-08-22 12-00
[33md8055d5[m HEAD@{162}: reset: moving to HEAD
[33md8055d5[m HEAD@{163}: commit: Automated update 2025-08-22 6-00
[33m3d35b58[m HEAD@{164}: reset: moving to HEAD
[33m3d35b58[m HEAD@{165}: commit: Automated update 2025-08-22 0-00
[33mf9655c7[m HEAD@{166}: reset: moving to HEAD
[33mf9655c7[m HEAD@{167}: commit: Automated update 2025-08-21 18-00
[33m6f51887[m HEAD@{168}: reset: moving to HEAD
[33m6f51887[m HEAD@{169}: commit: Automated update 2025-08-21 12-00
[33m0a536ee[m HEAD@{170}: reset: moving to HEAD
[33m0a536ee[m HEAD@{171}: commit: Automated update 2025-08-21 6-00
[33m8a3fb4f[m HEAD@{172}: reset: moving to HEAD
[33m8a3fb4f[m HEAD@{173}: commit: Automated update 2025-08-21 0-00
[33md1b8252[m HEAD@{174}: reset: moving to HEAD
[33md1b8252[m HEAD@{175}: commit: Automated update 2025-08-20 18-00
[33meff2e1c[m HEAD@{176}: reset: moving to HEAD
[33meff2e1c[m HEAD@{177}: commit: Flight Ping update 8/20/2025
[33m048c58d[m HEAD@{178}: commit: Automated update 2025-08-20 12-00
[33mec87ea6[m HEAD@{179}: reset: moving to HEAD
[33mec87ea6[m HEAD@{180}: commit: Automated update 2025-08-20 6-00
[33ma67fe08[m HEAD@{181}: reset: moving to HEAD
[33ma67fe08[m HEAD@{182}: commit: Automated update 2025-08-20 0-00
[33ma4bbac3[m HEAD@{183}: reset: moving to HEAD
[33ma4bbac3[m HEAD@{184}: commit: Automated update 2025-08-19 18-00
[33mac337c2[m HEAD@{185}: reset: moving to HEAD
[33mac337c2[m HEAD@{186}: commit: Automated update 2025-08-19 12-00
[33m7625e03[m HEAD@{187}: reset: moving to HEAD
[33m7625e03[m HEAD@{188}: commit: Automated update 2025-08-19 6-00
[33m9fad50a[m HEAD@{189}: reset: moving to HEAD
[33m9fad50a[m HEAD@{190}: commit: Automated update 2025-08-19 0-00
[33mb2fa9f2[m HEAD@{191}: reset: moving to HEAD
[33mb2fa9f2[m HEAD@{192}: commit: Automated update 2025-08-18 18-00
[33me30d11f[m HEAD@{193}: reset: moving to HEAD
[33me30d11f[m HEAD@{194}: commit: About modal text update
[33m9244f30[m HEAD@{195}: commit: 8/18/2025 Flight Ping Update
[33m33aaae2[m HEAD@{196}: commit: Automated update 2025-08-18 12-00
[33m7bdd4b8[m HEAD@{197}: reset: moving to HEAD
[33m7bdd4b8[m HEAD@{198}: commit: Automated update 2025-08-18 6-00
[33m8a6a96e[m HEAD@{199}: reset: moving to HEAD
[33m8a6a96e[m HEAD@{200}: commit: Automated update 2025-08-18 0-00
[33mf9f70ee[m HEAD@{201}: reset: moving to HEAD
[33mf9f70ee[m HEAD@{202}: commit: Automated update 2025-08-17 18-00
[33m09f9ad7[m HEAD@{203}: reset: moving to HEAD
[33m09f9ad7[m HEAD@{204}: commit: Automated update 2025-08-17 12-00
[33m80f2460[m HEAD@{205}: reset: moving to HEAD
[33m80f2460[m HEAD@{206}: commit: Automated update 2025-08-17 6-00
[33m7cb2a72[m HEAD@{207}: reset: moving to HEAD
[33m7cb2a72[m HEAD@{208}: commit: Automated update 2025-08-17 0-00
[33mfcdca17[m HEAD@{209}: reset: moving to HEAD
[33mfcdca17[m HEAD@{210}: commit: Automated update 2025-08-16 18-00
[33m35687ee[m HEAD@{211}: reset: moving to HEAD
[33m35687ee[m HEAD@{212}: commit: 8/16/2025 Flight Ping Update
[33m787e10c[m HEAD@{213}: commit: Automated update 2025-08-16 12-00
[33mbae129a[m HEAD@{214}: reset: moving to HEAD
[33mbae129a[m HEAD@{215}: commit: Automated update 2025-08-16 6-00
[33m8948d5f[m HEAD@{216}: reset: moving to HEAD
[33m8948d5f[m HEAD@{217}: commit: Automated update 2025-08-16 0-00
[33mdc5a160[m HEAD@{218}: reset: moving to HEAD
[33mdc5a160[m HEAD@{219}: commit: Automated update 2025-08-15 18-00
[33me735dc2[m HEAD@{220}: reset: moving to HEAD
[33me735dc2[m HEAD@{221}: commit: Automated update 2025-08-15 12-00
[33m2cd154b[m HEAD@{222}: reset: moving to HEAD
[33m2cd154b[m HEAD@{223}: commit: 8/15/2025 Flight Ping Update
[33m2df7f89[m HEAD@{224}: commit: Automated update 2025-08-15 6-00
[33m71638d2[m HEAD@{225}: reset: moving to HEAD
[33m71638d2[m HEAD@{226}: commit: Automated update 2025-08-15 0-00
[33mef0a554[m HEAD@{227}: reset: moving to HEAD
[33mef0a554[m HEAD@{228}: commit: Automated update 2025-08-14 18-00
[33m5d44f01[m HEAD@{229}: reset: moving to HEAD
[33m5d44f01[m HEAD@{230}: commit: 8/14/2025 Flight Ping Update
[33m6b96a68[m HEAD@{231}: commit: Automated update 2025-08-14 12-00
[33m8f01e5d[m HEAD@{232}: reset: moving to HEAD
[33m8f01e5d[m HEAD@{233}: commit: Automated update 2025-08-14 6-00
[33m7b3036d[m HEAD@{234}: reset: moving to HEAD
[33m7b3036d[m HEAD@{235}: commit: Automated update 2025-08-14 0-00
[33me1acbce[m HEAD@{236}: reset: moving to HEAD
[33me1acbce[m HEAD@{237}: commit: Automated update 2025-08-13 18-00
[33mba34c15[m HEAD@{238}: reset: moving to HEAD
[33mba34c15[m HEAD@{239}: commit: 8/13/2025 Flight Ping Update
[33m8d0613f[m HEAD@{240}: commit: Elessar description updated to new OpenAI model.
[33mde7bb1e[m HEAD@{241}: commit: Automated update 2025-08-13 12-00
[33m11097f8[m HEAD@{242}: reset: moving to HEAD
[33m11097f8[m HEAD@{243}: commit: Automated update 2025-08-13 6-00
[33m6158607[m HEAD@{244}: reset: moving to HEAD
[33m6158607[m HEAD@{245}: commit: Automated update 2025-08-13 0-00
[33m85cc754[m HEAD@{246}: reset: moving to HEAD
[33m85cc754[m HEAD@{247}: commit: Automated update 2025-08-12 18-00
[33ma66e072[m HEAD@{248}: reset: moving to HEAD
[33ma66e072[m HEAD@{249}: commit: Automated update 2025-08-12 12-00
[33med62d00[m HEAD@{250}: reset: moving to HEAD
[33med62d00[m HEAD@{251}: commit: Automated update 2025-08-12 0-00
[33m2857904[m HEAD@{252}: reset: moving to HEAD
[33m2857904[m HEAD@{253}: commit: Automated update 2025-08-11 18-00
[33m81d5dce[m HEAD@{254}: reset: moving to HEAD
[33m81d5dce[m HEAD@{255}: commit: Automated update 2025-08-11 12-00
[33m629dd12[m HEAD@{256}: reset: moving to HEAD
[33m629dd12[m HEAD@{257}: commit: Automated update 2025-08-11 6-00
[33m6114309[m HEAD@{258}: reset: moving to HEAD
[33m6114309[m HEAD@{259}: commit: Automated update 2025-08-11 0-00
[33ma0bcc91[m HEAD@{260}: reset: moving to HEAD
[33ma0bcc91[m HEAD@{261}: commit: Automated update 2025-08-10 18-00
[33m5ba0c05[m HEAD@{262}: reset: moving to HEAD
[33m5ba0c05[m HEAD@{263}: commit: Automated update 2025-08-10 12-00
[33m5fc5b82[m HEAD@{264}: reset: moving to HEAD
[33m5fc5b82[m HEAD@{265}: commit: Automated update 2025-08-10 7-32
[33mc4e69bf[m HEAD@{266}: reset: moving to HEAD
[33mc4e69bf[m HEAD@{267}: commit: Automated update 2025-08-10 6-00
[33m2746dc4[m HEAD@{268}: reset: moving to HEAD
[33m2746dc4[m HEAD@{269}: commit: Automated update 2025-08-10 0-00
[33mabf494b[m HEAD@{270}: reset: moving to HEAD
[33mabf494b[m HEAD@{271}: commit: Automated update 2025-08-09 18-00
[33m85cd344[m HEAD@{272}: reset: moving to HEAD
[33m85cd344[m HEAD@{273}: commit: Manual update 8/9/2025
[33ma2a13ab[m HEAD@{274}: commit: Automated update 2025-08-09 12-00
[33m2105758[m HEAD@{275}: reset: moving to HEAD
[33m2105758[m HEAD@{276}: commit: Manual update 8/9/2025
[33m338ce1d[m HEAD@{277}: commit: Automated update 2025-08-09 6-00
[33m8c1e505[m HEAD@{278}: reset: moving to HEAD
[33m8c1e505[m HEAD@{279}: commit: Automated update 2025-08-09 0-00
[33m3af79a3[m HEAD@{280}: reset: moving to HEAD
[33m3af79a3[m HEAD@{281}: commit: Manual update 8/8/2025
[33m8e177ee[m HEAD@{282}: commit: Automated update 2025-08-08 19-46
[33m7918a73[m HEAD@{283}: reset: moving to HEAD
[33m7918a73[m HEAD@{284}: commit: Manual update 8/8/2025
[33meb39b12[m HEAD@{285}: commit: Automated update 2025-08-08 18-00
[33m97babc8[m HEAD@{286}: reset: moving to HEAD
[33m97babc8[m HEAD@{287}: commit: Manual update 8/8/2025
[33mb527e40[m HEAD@{288}: commit: Automated update 2025-08-08 12-00
[33m4add357[m HEAD@{289}: reset: moving to HEAD
[33m4add357[m HEAD@{290}: commit: Manual update 8/8/2025
[33mcb97127[m HEAD@{291}: commit: Automated update 2025-08-08 6-00
[33m245e0c8[m HEAD@{292}: reset: moving to HEAD
[33m245e0c8[m HEAD@{293}: commit: Automated update 2025-08-08 0-00
[33m24da672[m HEAD@{294}: reset: moving to HEAD
[33m24da672[m HEAD@{295}: commit: Automated update 2025-08-07 18-00
[33m05524f8[m HEAD@{296}: reset: moving to HEAD
[33m05524f8[m HEAD@{297}: commit: Manual update 8/7/2025
[33m0a3115c[m HEAD@{298}: commit: Automated update 2025-08-07 16-16
[33maf9a98d[m HEAD@{299}: reset: moving to HEAD
[33maf9a98d[m HEAD@{300}: commit: Automated update 2025-08-07 12-00
[33m8bbf9fc[m HEAD@{301}: reset: moving to HEAD
[33m8bbf9fc[m HEAD@{302}: commit: Automated update 2025-08-07 6-00
[33m7587cf1[m HEAD@{303}: reset: moving to HEAD
[33m7587cf1[m HEAD@{304}: commit: Automated update 2025-08-07 0-00
[33mea4c952[m HEAD@{305}: reset: moving to HEAD
[33mea4c952[m HEAD@{306}: commit: Manual update 8/6/2025
[33m241ba15[m HEAD@{307}: commit: Automated update 2025-08-06 20-46
[33m6f5cbd4[m HEAD@{308}: reset: moving to HEAD
[33m6f5cbd4[m HEAD@{309}: commit: Manual update 8/6/2025
[33m6ca9105[m HEAD@{310}: commit: Automated update 2025-08-06 18-00
[33me9970d7[m HEAD@{311}: reset: moving to HEAD
[33me9970d7[m HEAD@{312}: commit: Automated update 2025-08-06 12-00
[33m1200576[m HEAD@{313}: reset: moving to HEAD
[33m1200576[m HEAD@{314}: commit: Manual update 8/5/2025
[33m49ef756[m HEAD@{315}: commit: Automated update 2025-08-06 6-00
[33m7cca0ef[m HEAD@{316}: reset: moving to HEAD
[33m7cca0ef[m HEAD@{317}: commit: Automated update 2025-08-06 0-00
[33m672dcde[m HEAD@{318}: reset: moving to HEAD
[33m672dcde[m HEAD@{319}: commit: Manual update 8/5/2025
[33mc7369c6[m HEAD@{320}: commit: Automated update 2025-08-05 18-00
[33mef83f95[m HEAD@{321}: reset: moving to HEAD
[33mef83f95[m HEAD@{322}: commit: Manual update 8/5/2025
[33m4c7afe8[m HEAD@{323}: commit: Automated update 2025-08-05 12-00
[33md9ca652[m HEAD@{324}: reset: moving to HEAD
[33md9ca652[m HEAD@{325}: commit: 8/5/2025 Flight Ping Update
[33mec8bd6d[m HEAD@{326}: commit: 8/5/2025 Flight Ping Update
[33mbb582c4[m HEAD@{327}: commit: Automated update 2025-08-05 6-00
[33me45fbc9[m HEAD@{328}: reset: moving to HEAD
[33me45fbc9[m HEAD@{329}: commit: Automated update 2025-08-05 0-00
[33m19544e5[m HEAD@{330}: reset: moving to HEAD
[33m19544e5[m HEAD@{331}: commit: Automated update 2025-08-04 18-00
[33m0b626e3[m HEAD@{332}: reset: moving to HEAD
[33m0b626e3[m HEAD@{333}: commit: Changes to alpha banner with addition of dynamic metadata on recent ai parsing quality
[33mab35096[m HEAD@{334}: commit: Automated update 2025-08-04 12-00
[33m0f2e69b[m HEAD@{335}: reset: moving to HEAD
[33m0f2e69b[m HEAD@{336}: commit: Automated update 2025-08-04 6-00
[33m2b013e0[m HEAD@{337}: reset: moving to HEAD
[33m2b013e0[m HEAD@{338}: commit: Automated update 2025-08-04 0-00
[33me05b203[m HEAD@{339}: reset: moving to HEAD
[33me05b203[m HEAD@{340}: commit: Automated update 2025-08-03 20-10
[33mb52d51b[m HEAD@{341}: reset: moving to HEAD
[33mb52d51b[m HEAD@{342}: commit: Automated update 2025-08-03 18-00
[33m462acb1[m HEAD@{343}: reset: moving to HEAD
[33m462acb1[m HEAD@{344}: commit: Automated update 2025-08-03 12-00
[33maa35cd3[m HEAD@{345}: reset: moving to HEAD
[33maa35cd3[m HEAD@{346}: commit: Automated update 2025-08-03 6-00
[33m9397fd6[m HEAD@{347}: reset: moving to HEAD
[33m9397fd6[m HEAD@{348}: commit: Automated update 2025-08-03 0-00
[33m1d1718a[m HEAD@{349}: reset: moving to HEAD
[33m1d1718a[m HEAD@{350}: commit: Automated update 2025-08-02 18-00
[33m975248b[m HEAD@{351}: reset: moving to HEAD
[33m975248b[m HEAD@{352}: commit: Automated update 2025-08-02 16-13
[33mdb207c4[m HEAD@{353}: reset: moving to HEAD
[33mdb207c4[m HEAD@{354}: commit: Automated update 2025-08-02 12-00
[33m189aaca[m HEAD@{355}: reset: moving to HEAD
[33m189aaca[m HEAD@{356}: commit: Automated update 2025-08-02 6-00
[33m7410a33[m HEAD@{357}: commit: Automated update 2025-08-02 0-00
[33m3cd02c2[m HEAD@{358}: commit: 8/01/2025 Flight Ping Update
[33m7aa6675[m HEAD@{359}: commit: Automated update 2025-08-01 18-00
[33me67dade[m HEAD@{360}: commit: Automated update 2025-08-01 12-00
[33m5d24dc1[m HEAD@{361}: commit: Automated update 2025-08-01 6-00
[33m27b6e6b[m HEAD@{362}: commit: Automated update 2025-08-01 0-00
[33m5cf7aef[m HEAD@{363}: commit: Automated update 2025-07-31 18-00
[33m8bf769b[m HEAD@{364}: commit: Automated update 2025-07-31 12-00
[33m60bc775[m HEAD@{365}: commit: Automated update 2025-07-31 6-00
[33mef64347[m HEAD@{366}: commit: Automated update 2025-07-31 0-00
[33mc169cc1[m HEAD@{367}: commit: Automated update 2025-07-30 18-00
[33m676270e[m HEAD@{368}: commit: 7/30/2025 Flight Ping Update
[33mc48526c[m HEAD@{369}: commit: Automated update 2025-07-30 12-00
[33m0decbc8[m HEAD@{370}: commit: Automated update 2025-07-30 6-00
[33m18e6bc4[m HEAD@{371}: commit: Automated update 2025-07-30 0-00
[33m942f7b4[m HEAD@{372}: commit: 7/29/2025 Flight Ping Update
[33meb8e84f[m HEAD@{373}: commit: Automated update 2025-07-29 18-00
[33mfd435d3[m HEAD@{374}: commit: Automated update 2025-07-29 12-00
[33mb6088dc[m HEAD@{375}: commit: Automated update 2025-07-29 6-00
[33m4572b32[m HEAD@{376}: commit: Automated update 2025-07-29 0-00
[33m05188ff[m HEAD@{377}: commit: Automated update 2025-07-28 18-00
[33m0bfe7b8[m HEAD@{378}: commit: Automated update 2025-07-28 12-00
[33mfb2d4b9[m HEAD@{379}: commit: Automated update 2025-07-28 6-00
[33mf8e1002[m HEAD@{380}: commit: Automated update 2025-07-28 0-00
[33m404ac4a[m HEAD@{381}: commit: Automated update 2025-07-27 18-00
[33m94b219b[m HEAD@{382}: merge origin/main: Merge made by the 'ort' strategy.
[33m6af998e[m HEAD@{383}: commit: 7/27/2025 Flight Ping Update
[33m9a427b4[m HEAD@{384}: commit: Automated update 2025-07-27 12-00
[33mea16e33[m HEAD@{385}: commit: Automated update 2025-07-27 10-06
[33m5be57c0[m HEAD@{386}: commit: Automated update 2025-07-26 18-00
[33m9a394b5[m HEAD@{387}: commit: Changes to flight widget pop-up. Replaced local TZ display with more consistent UTC display to avoid confusion.
[33ma521d69[m HEAD@{388}: commit: 7/26/2025 Flight Ping Update
[33m9a6a7bb[m HEAD@{389}: commit: 7/26/2025 Flight Ping Update
[33mfae2068[m HEAD@{390}: commit: Automated update 2025-07-26 12-00
[33mfad23e0[m HEAD@{391}: commit: Automated update 2025-07-26 6-00
[33m5ac57d5[m HEAD@{392}: commit: Automated update 2025-07-26 0-00
[33m64b503e[m HEAD@{393}: commit: Automated update 2025-07-25 18-00
[33m44c8fc6[m HEAD@{394}: commit: Automated update 2025-07-25 12-00
[33mdb5c961[m HEAD@{395}: commit: Automated update 2025-07-25 6-00
[33m919c4d4[m HEAD@{396}: commit: Automated update 2025-07-25 0-00
[33mae07bd5[m HEAD@{397}: commit: Automated update 2025-07-24 18-00
[33m410a1a2[m HEAD@{398}: commit: Automated update 2025-07-24 12-00
[33m99fe3db[m HEAD@{399}: commit: Automated update 2025-07-24 6-00
[33m38f3893[m HEAD@{400}: commit: Automated update 2025-07-24 0-00
[33m076cb2a[m HEAD@{401}: commit: Automated update 2025-07-23 18-00
[33m6e72a3d[m HEAD@{402}: commit: Automated update 2025-07-23 12-00
[33md725d6b[m HEAD@{403}: commit: Automated update 2025-07-23 6-00
[33m10800a8[m HEAD@{404}: commit: Automated update 2025-07-23 0-00
[33m04b84e7[m HEAD@{405}: commit: 7/22/2025 Flight Ping Update
[33mb9ef8a5[m HEAD@{406}: commit: Automated update 2025-07-22 18-00
[33mf1ce7f8[m HEAD@{407}: commit: Automated update 2025-07-22 12-00
[33mddc613a[m HEAD@{408}: commit: Automated update 2025-07-22 6-00
[33m0266eb0[m HEAD@{409}: commit: Automated update 2025-07-22 0-00
[33mab713e9[m HEAD@{410}: commit: Automated update 2025-07-21 18-00
[33mde9a6b3[m HEAD@{411}: commit: Automated update 2025-07-21 12-00
[33m42016a9[m HEAD@{412}: commit: Automated update 2025-07-21 6-00
[33m73f1e61[m HEAD@{413}: commit: refresh
[33m99b70b6[m HEAD@{414}: commit: Automated update 2025-07-21 0-00
[33m6abdcc2[m HEAD@{415}: commit: Automated update 2025-07-20 18-00
[33m7aaf7a4[m HEAD@{416}: commit: Bug fix for Flight Data button in custom Spiderfly logic.
[33m0693890[m HEAD@{417}: commit: 7/20/2025 Flight Ping Update
[33m5f4a71e[m HEAD@{418}: commit: Automated update 2025-07-20 12-00
[33mcec3e1a[m HEAD@{419}: commit: Automated update 2025-07-20 6-00
[33m809f9ec[m HEAD@{420}: commit: Automated update 2025-07-20 0-00
[33m3787471[m HEAD@{421}: commit: Automated update 2025-07-19 18-00
[33mab0cb16[m HEAD@{422}: commit: 7/19/2025 Flight Ping Update
[33m8417fa9[m HEAD@{423}: commit: Automated update 2025-07-19 12-00
[33m866bf3e[m HEAD@{424}: commit: Automated update 2025-07-19 6-00
[33m0f8e351[m HEAD@{425}: commit: Automated update 2025-07-19 0-00
[33mdfd0d65[m HEAD@{426}: commit: Automated update 2025-07-18 18-00
[33mbf2340f[m HEAD@{427}: commit: Automated update 2025-07-18 12-00
[33m0476ddc[m HEAD@{428}: commit: Automated update 2025-07-18 6-00
[33m86447e7[m HEAD@{429}: commit: Automated update 2025-07-18 0-00
[33m774d52c[m HEAD@{430}: commit: Automated update 2025-07-17 18-00
[33me6a15bc[m HEAD@{431}: commit: Automated update 2025-07-17 12-00
[33m1f001c5[m HEAD@{432}: commit: Automated update 2025-07-17 6-00
[33m4cd47cd[m HEAD@{433}: commit: Automated update 2025-07-17 0-00
[33m4950c51[m HEAD@{434}: commit: 7/16/2025 Flight Ping Update
[33mca2ac37[m HEAD@{435}: commit: Automated update 2025-07-16 18-00
[33m767cc53[m HEAD@{436}: commit: 7/16/2025 Flight Ping Update
[33mef31887[m HEAD@{437}: commit: Automated update 2025-07-16 12-00
[33mb1ed2f5[m HEAD@{438}: commit: Automated update 2025-07-16 6-00
[33mc8b27af[m HEAD@{439}: commit: Automated update 2025-07-16 0-00
[33maa69429[m HEAD@{440}: commit: 7/15/2025 Flight Ping Update
[33mbd38c6e[m HEAD@{441}: commit: Automated update 2025-07-15 18-00
[33me2c34d3[m HEAD@{442}: commit: Automated update 2025-07-15 12-00
[33ma6f78c8[m HEAD@{443}: commit: Automated update 2025-07-15 6-00
[33mcbbd264[m HEAD@{444}: commit: Automated update 2025-07-15 0-00
[33mccd3faa[m HEAD@{445}: commit: Automated update 2025-07-14 18-00
[33me5189ce[m HEAD@{446}: commit: Automated update 2025-07-14 12-00
[33m3628198[m HEAD@{447}: commit: Automated update 2025-07-14 6-00
[33mddbffc6[m HEAD@{448}: commit: 7/14/2025 Flight Ping Update
[33m789c012[m HEAD@{449}: commit: Automated update 2025-07-14 0-00
[33m5361f49[m HEAD@{450}: commit: Automated update 2025-07-13 18-00
[33maa5ad13[m HEAD@{451}: commit: Automated update 2025-07-13 12-00
[33m3601581[m HEAD@{452}: commit: 7/13/2025 Flight Ping Update
[33m8e4e137[m HEAD@{453}: commit: Automated update 2025-07-13 6-00
[33m5f01465[m HEAD@{454}: commit: Automated update 2025-07-13 0-00
[33m6cf0fc8[m HEAD@{455}: commit: Automated update 2025-07-12 18-00
[33m3c7c54c[m HEAD@{456}: commit: Automated update 2025-07-12 12-00
[33mcbc7d22[m HEAD@{457}: commit: Automated update 2025-07-12 6-00
[33m00d2b34[m HEAD@{458}: commit: Automated update 2025-07-12 0-00
[33md65f809[m HEAD@{459}: commit: 7/11/2025 Flight Ping Update
[33ma1a9c3e[m HEAD@{460}: commit: Automated update 2025-07-11 18-00
[33m08deca6[m HEAD@{461}: commit: Automated update 2025-07-11 12-00
[33m60f1ce9[m HEAD@{462}: commit: Automated update 2025-07-11 6-00
[33m867636c[m HEAD@{463}: commit: Automated update 2025-07-11 0-00
[33m289fc80[m HEAD@{464}: commit: Automated update 2025-07-10 18-00
[33md37666c[m HEAD@{465}: commit: Automated update 2025-07-10 12-00
[33md72442e[m HEAD@{466}: commit: Automated update 2025-07-10 6-00
[33mc9b35b2[m HEAD@{467}: commit: Automated update 2025-07-10 0-00
[33m5fcd80d[m HEAD@{468}: commit: Automated update 2025-07-09 18-00
[33m9629b13[m HEAD@{469}: commit: 7/9/2025 Flight Ping Update
[33ma87984d[m HEAD@{470}: commit: Automated update 2025-07-09 12-00
[33m2a7742c[m HEAD@{471}: commit: Automated update 2025-07-09 0-00
[33mc7d4026[m HEAD@{472}: commit: 7/8/2025 Flight Ping Update
[33mb4b95e4[m HEAD@{473}: commit: Automated update 2025-07-08 18-00
[33m186adf0[m HEAD@{474}: commit: Automated update 2025-07-08 12-00
[33md1d2774[m HEAD@{475}: commit: 7/8/2025 Flight Ping Update
[33m82aade9[m HEAD@{476}: commit: Automated update 2025-07-08 6-00
[33m27a35fc[m HEAD@{477}: commit: Automated update 2025-07-08 0-00
[33m39915ec[m HEAD@{478}: commit: Automated update 2025-07-07 18-00
[33mc1296e3[m HEAD@{479}: commit: Automated update 2025-07-07 12-00
[33m9b516ba[m HEAD@{480}: commit: 7/7/2025 Flight Ping Update
[33m79e7c23[m HEAD@{481}: commit: Automated update 2025-07-07 6-00
[33m0eaad10[m HEAD@{482}: commit: Automated update 2025-07-07 0-00
[33mcc2cf73[m HEAD@{483}: commit: Automated update 2025-07-06 18-00
[33mc6502fa[m HEAD@{484}: commit: Automated update 2025-07-06 12-00
[33mdbc2e8e[m HEAD@{485}: commit: Automated update 2025-07-06 6-00
[33m8e1c5aa[m HEAD@{486}: commit: Automated update 2025-07-06 0-00
[33mfa0114e[m HEAD@{487}: commit: Automated update 2025-07-05 18-00
[33me50422a[m HEAD@{488}: commit: Automated update 2025-07-05 12-00
[33mbd73979[m HEAD@{489}: commit: Automated update 2025-07-05 6-00
[33m4e1548f[m HEAD@{490}: commit: Automated update 2025-07-05 0-00
[33m5d51bd6[m HEAD@{491}: commit: Automated update 2025-07-04 18-00
[33m8eb4cc8[m HEAD@{492}: commit: Automated update 2025-07-04 12-00
[33m6d6f76d[m HEAD@{493}: commit: Automated update 2025-07-04 6-00
[33m03a11c9[m HEAD@{494}: commit: Automated update 2025-07-04 0-00
[33m85fdd12[m HEAD@{495}: commit: Automated update 2025-07-03 18-00
[33m2a44542[m HEAD@{496}: commit: Automated update 2025-07-03 12-00
[33m27709dc[m[33m ([m[1;33mtag: [m[1;33mv0.2.5-alpha[m[33m)[m HEAD@{497}: commit: Automated update 2025-07-03 6-00
[33m570d14d[m HEAD@{498}: commit: Automated update 2025-07-03 0-00
[33m6dc2480[m HEAD@{499}: commit: Automated update 2025-07-02 18-00
[33mf720b58[m HEAD@{500}: commit: Automated update 2025-07-02 12-00
[33mf2fcdea[m HEAD@{501}: commit: Automated update 2025-07-02 6-00
[33m33aa731[m HEAD@{502}: commit: Automated update 2025-07-02 0-00
[33m3bc5e53[m HEAD@{503}: commit: Automated update 2025-07-01 18-00
[33mb350b46[m HEAD@{504}: commit: switched back to public MB token
[33m90e455f[m HEAD@{505}: commit: Added spiderfly functionality to clustered points to avoid sighting_id stacking. Credit to Tomas Tubert (https://medium.com/@tomytubert/mapbox-spiderfy-clusters-without-library-8936d4f45347) for the implementation idea. I couldn't get their library to load for me, so I had to make a similar one myself.
[33mcd25ff1[m HEAD@{506}: commit: 7/1/2025 flight ping update
[33m7b94875[m HEAD@{507}: commit: Automated update 2025-07-01 12-00
[33m957eeb1[m HEAD@{508}: commit: Automated update 2025-07-01 6-00
[33m8532e78[m HEAD@{509}: commit: Automated update 2025-07-01 0-00
[33mf9d7a94[m HEAD@{510}: commit: Automated update 2025-06-30 18-00
[33m63bb854[m HEAD@{511}: commit: Automated update 2025-06-30 12-00
[33m3e073a0[m HEAD@{512}: commit: 6/30/2025 flight ping update
[33m8eb7902[m HEAD@{513}: commit: Automated update 2025-06-30 6-00
[33m7511fe0[m HEAD@{514}: commit: Automated update 2025-06-30 0-00
[33m48486f8[m HEAD@{515}: commit: Automated update 2025-06-29 18-00
[33m7217e8c[m HEAD@{516}: commit: Automated update 2025-06-29 12-00
[33m5f53055[m HEAD@{517}: commit: Automated update 2025-06-29 6-00
[33mcfcdda0[m HEAD@{518}: commit: Automated update 2025-06-29 0-00
[33m0fac5a0[m HEAD@{519}: commit: Automated update 2025-06-28 18-00
[33m0f525a8[m HEAD@{520}: commit: Automated update 2025-06-28 12-00
[33m970c3b4[m HEAD@{521}: commit: Automated update 2025-06-28 6-00
[33mfccf2de[m HEAD@{522}: commit: Automated update 2025-06-28 0-00
[33m1404357[m HEAD@{523}: commit: Automated update 2025-06-27 18-00
[33m69ff934[m HEAD@{524}: commit: Automated update 2025-06-27 12-00
[33mcd017fd[m HEAD@{525}: commit: 6/27/2025 flight ping update
[33m3205b20[m HEAD@{526}: commit: Automated update 2025-06-27 6-00
[33ma8930f2[m HEAD@{527}: commit: Automated update 2025-06-27 0-00
[33m046ee64[m HEAD@{528}: commit: Automated update 2025-06-26 18-00
[33mb3d14d3[m HEAD@{529}: commit: Changed to public MapBox token
[33mdf5f523[m HEAD@{530}: pull origin main: Fast-forward
[33m5cda3af[m HEAD@{531}: commit: 6/26/2025 Batch flight ping update
[33m503d117[m HEAD@{532}: commit: Automated update 2025-06-26 6-00
[33m2228123[m HEAD@{533}: commit: Automated update 2025-06-26 0-00
[33m48f183f[m HEAD@{534}: commit: Automated update 2025-06-25 18-00
[33m9f675c5[m HEAD@{535}: commit: 6/25/2025 Batch flight ping update
[33m893a5f8[m HEAD@{536}: commit: Automated update 2025-06-25 12-00
[33m0876392[m HEAD@{537}: commit: Automated update 2025-06-25 6-00
[33mf3c14f3[m HEAD@{538}: commit: Automated update 2025-06-25 0-00
[33mcb9d75a[m HEAD@{539}: commit: Automated update 2025-06-24 18-00
[33m324ca4f[m HEAD@{540}: commit: 6/24/2025 Batch flight ping update
[33mef80403[m HEAD@{541}: commit: Automated update 2025-06-24 12-00
[33m210102b[m HEAD@{542}: commit: Automated update 2025-06-24 6-00
[33m715a973[m HEAD@{543}: commit: Automated update 2025-06-24 0-00
[33m9ab0b75[m HEAD@{544}: commit: Automated update 2025-06-23 18-00
[33me34009d[m HEAD@{545}: commit: Automated update 2025-06-23 12-00
[33me0275ea[m HEAD@{546}: commit: Automated update 2025-06-23 6-00
[33m660c06d[m HEAD@{547}: commit: Automated update 2025-06-23 0-00
[33m055e57a[m HEAD@{548}: commit: Automated update 2025-06-22 18-00
[33m5be0f5a[m HEAD@{549}: commit: Automated update 2025-06-22 12-00
[33m2fd3d1d[m HEAD@{550}: commit: Automated update 2025-06-22 6-00
[33m72b512a[m HEAD@{551}: commit: Automated update 2025-06-22 0-00
[33m2382c99[m HEAD@{552}: commit: Automated update 2025-06-21 18-00
[33m85324dc[m HEAD@{553}: commit: Automated update 2025-06-21 12-00
[33me1f5325[m HEAD@{554}: commit: Automated update 2025-06-21 6-00
[33m670b3d9[m HEAD@{555}: commit: Automated update 2025-06-21 0-00
[33m20628b3[m HEAD@{556}: commit: Automated update 2025-06-20 18-00
[33mca49ee6[m HEAD@{557}: commit: Automated update 2025-06-20 12-00
[33m642f3ab[m HEAD@{558}: commit: Automated update 2025-06-20 6-00
[33mf210d34[m HEAD@{559}: commit: Automated update 2025-06-20 0-00
[33m0d5fedc[m HEAD@{560}: commit: Automated update 2025-06-19 18-00
[33m0b584f6[m HEAD@{561}: commit: Automated update 2025-06-19 12-00
[33m51ae1d4[m HEAD@{562}: commit: Automated update 2025-06-19 6-00
[33mf9d7bf5[m HEAD@{563}: commit: Automated update 2025-06-19 0-00
[33mffc2e64[m HEAD@{564}: commit: Automated update 2025-06-18 18-00
[33m0da28d4[m HEAD@{565}: commit: Automated update 2025-06-18 12-00
[33m6339f3f[m HEAD@{566}: commit: Automated update 2025-06-18 6-00
[33mb20fe14[m HEAD@{567}: commit: Automated update 2025-06-18 0-00
[33m19d549e[m HEAD@{568}: commit: Banner adjustments
[33m351a465[m HEAD@{569}: commit: Pop up work - Added embed videos, styles/shaders, and flight widget pop up management improved.
[33m679cb10[m HEAD@{570}: commit: Automated update 2025-06-17 18-33
[33m8d806b8[m HEAD@{571}: commit: 6/17/2025 batch update of flight pings
[33m360e4fb[m HEAD@{572}: commit: Automated update 2025-06-17 18-00
[33m855ce5d[m HEAD@{573}: commit: Automated update 2025-06-17 12-00
[33m51b083f[m HEAD@{574}: commit: Automated update 2025-06-17 6-00
[33m9c032b0[m HEAD@{575}: commit: Fix to Recent Sightings shaders in drawer menu
[33m46effef[m HEAD@{576}: commit: Added dynamic button controls and optimized for mobile. Fixed bug for explore a region search feature not populating list. Updated alpha version number to 0.2.5
[33m774257a[m HEAD@{577}: commit: Automated update 2025-06-17 0-00
[33m135b184[m HEAD@{578}: commit: Automated update 2025-06-16 18-00
[33ma5aefc1[m HEAD@{579}: commit: Automated update 2025-06-16 12-00
[33mefae303[m HEAD@{580}: commit: 6/16/2025 batch update of flight pings
[33mb9303b4[m HEAD@{581}: commit: Automated update 2025-06-16 6-00
[33med200e0[m HEAD@{582}: commit: Automated update 2025-06-16 0-00
[33m043ce5c[m HEAD@{583}: commit: Automated update 2025-06-15 18-00
[33md7b4bea[m HEAD@{584}: commit: Fixed popup duplication at map edges and added bounds checking for pop-up
[33mac3eea3[m HEAD@{585}: commit: .
[33mfd495c6[m HEAD@{586}: commit: Automated update 2025-06-15 12-05
[33m1232e53[m HEAD@{587}: commit: Automated update 2025-06-15 6-00
[33m21f6996[m HEAD@{588}: commit: Automated update 2025-06-15 0-13
[33m1473e73[m HEAD@{589}: commit: Automated update 2025-06-14 18-00
[33ma2b24ce[m HEAD@{590}: commit: Automated update 2025-06-14 12-00
[33m8c452f4[m HEAD@{591}: commit: Automated update 2025-06-14 6-00
[33m406c876[m HEAD@{592}: commit: Automated update 2025-06-14 0-00
[33m59da218[m HEAD@{593}: commit: Automated update 2025-06-13 18-00
[33mf8763cd[m HEAD@{594}: commit: Automated update 2025-06-13 12-00
[33m55f3ae9[m HEAD@{595}: commit: Automated update 2025-06-13 6-00
[33m945f6d6[m HEAD@{596}: commit: Automated update 2025-06-13 0-00
[33mec07ba1[m HEAD@{597}: commit: Automated update 2025-06-12 18-00
[33m677c5b9[m HEAD@{598}: commit: Automated update 2025-06-12 12-00
[33ma32be8d[m HEAD@{599}: commit: Automated update 2025-06-12 6-00
[33m3a3e281[m HEAD@{600}: commit: Automated update 2025-06-12 0-00
[33mf06c3ba[m HEAD@{601}: commit: Automated update 2025-06-11 18-00
[33mf55bcb9[m HEAD@{602}: commit: Automated update 2025-06-11 12-00
[33mc05e878[m HEAD@{603}: commit: Automated update 2025-06-11 0-00
[33mb8725bc[m HEAD@{604}: commit: Automated update 2025-06-10 18-00
[33m16ff495[m HEAD@{605}: commit: Automated update 2025-06-10 12-00
[33m0845ec5[m HEAD@{606}: commit: Automated update 2025-06-10 6-00
[33mc4a25b9[m HEAD@{607}: commit: Automated update 2025-06-10 0-00
[33m8f2a80a[m HEAD@{608}: commit: Automated update 2025-06-09 18-00
[33m2f93547[m HEAD@{609}: commit: Automated update 2025-06-09 12-00
[33m9b821a2[m HEAD@{610}: commit: Automated update 2025-06-09 6-00
[33mc867e68[m HEAD@{611}: commit: Automated update 2025-06-09 0-00
[33m03896b3[m HEAD@{612}: commit: Automated update 2025-06-08 18-00
[33m0bcc4e1[m HEAD@{613}: commit: Automated update 2025-06-08 12-14
[33m68c352a[m HEAD@{614}: commit (merge): Merge remote-tracking branch 'origin/main'
[33mbe6c865[m HEAD@{615}: commit: .
[33mf0f7266[m HEAD@{616}: commit: .
[33mcebbba0[m HEAD@{617}: commit: batch repost
[33me12b776[m HEAD@{618}: commit: batch repost
[33mfec73a4[m HEAD@{619}: commit: batch repost
[33mf162cb5[m HEAD@{620}: commit: Automated update Tue 06/03/2025 19:29:09.73
[33m9ea9193[m HEAD@{621}: merge origin/main: Merge made by the 'ort' strategy.
[33mb02e94a[m HEAD@{622}: commit: batch repost
[33m6b56001[m HEAD@{623}: commit: Automated update Tue 06/03/2025 18:00:02.03
[33m7ff6fc1[m HEAD@{624}: commit: batch repost
[33mb743f80[m HEAD@{625}: commit: ✅ Upserted 9163 pings into flight_pings db
[33m0c818ac[m HEAD@{626}: commit: Enabled flight widget to main
[33mf124906[m HEAD@{627}: commit: Changed to publuc token
[33m316e703[m HEAD@{628}: commit: Added alpha banner and changes to about modal for details on mobile support.
[33m7da7f43[m HEAD@{629}: commit: Committed flight pings data and flight widget modular to main. These are currently under testing and flight data are not yet available for all sighting_id values
[33m4f4e4e0[m HEAD@{630}: commit: Automated update Tue 06/03/2025 12:00:02.02
[33m9228a6f[m HEAD@{631}: commit: Automated update Tue 06/03/2025 6:00:02.01
[33ma93bad1[m HEAD@{632}: commit: Automated update Tue 06/03/2025 0:00:02.00
[33mabcbd8f[m HEAD@{633}: commit: Automated update Mon 06/02/2025 18:00:01.95
[33me9be2a2[m HEAD@{634}: merge origin/main: Merge made by the 'ort' strategy.
[33m1f7fd51[m HEAD@{635}: commit: Automated update Mon 06/02/2025 12:00:01.94
[33mb4a4c21[m HEAD@{636}: commit: Automated update Mon 06/02/2025 6:00:01.91
[33m07b4c1d[m HEAD@{637}: commit: Automated update Mon 06/02/2025 0:00:01.91
[33ma55c708[m HEAD@{638}: commit: Automated update Sun 06/01/2025 18:00:01.86
[33m6e86c9e[m HEAD@{639}: commit: Automated update Sun 06/01/2025 12:00:01.83
[33m54395ff[m HEAD@{640}: commit: Automated update Sun 06/01/2025 6:00:01.84
[33m2cf586c[m HEAD@{641}: commit: Automated update Sun 06/01/2025 0:00:01.81
[33m5d778be[m HEAD@{642}: commit: Automated update Sat 05/31/2025 18:00:01.78
[33m482e4e9[m HEAD@{643}: commit: Automated update Sat 05/31/2025 12:00:01.76
[33m3c1cd6f[m HEAD@{644}: commit: Automated update Sat 05/31/2025 6:00:01.76
[33ma244764[m HEAD@{645}: commit: Automated update Sat 05/31/2025 0:00:01.73
[33me8ee961[m HEAD@{646}: commit: Automated update Fri 05/30/2025 18:00:01.70
[33m72a53a4[m HEAD@{647}: commit: Automated update Fri 05/30/2025 12:00:01.68
[33m7674197[m HEAD@{648}: commit (merge): Merge remote-tracking branch 'origin/main'
[33m86e39da[m HEAD@{649}: commit: Automated update Fri 05/30/2025 10:02:29.43
[33m118424a[m HEAD@{650}: commit: Automated update Fri 05/30/2025 6:00:01.66
[33m35ce30d[m HEAD@{651}: commit: Changes to contact info
[33ma477435[m HEAD@{652}: commit: Automated update Fri 05/30/2025 0:15:02.96
[33m8b71caa[m HEAD@{653}: merge origin/main: Merge made by the 'ort' strategy.
[33m61eaf7d[m HEAD@{654}: commit: Automated update Fri 05/30/2025 0:00:01.66
[33mf8f6708[m HEAD@{655}: commit: Automated update Thu 05/29/2025 18:00:01.64
[33m1f18013[m HEAD@{656}: commit: Automated update Thu 05/29/2025 12:00:01.61
[33mec5b3fb[m HEAD@{657}: commit: Automated update Thu 05/29/2025 6:00:01.59
[33m866ae14[m HEAD@{658}: commit: Automated update Thu 05/29/2025 0:00:01.61
[33m6e72010[m HEAD@{659}: commit: Automated update Wed 05/28/2025 18:00:01.55
[33m8d68ecd[m HEAD@{660}: commit: Automated update Wed 05/28/2025 12:00:01.54
[33m288eb79[m HEAD@{661}: commit: Automated update Wed 05/28/2025 6:00:01.52
[33m6933191[m HEAD@{662}: commit: Automated update Wed 05/28/2025 0:00:01.52
[33m9b52de0[m HEAD@{663}: commit: Automated update Tue 05/27/2025 18:00:01.48
[33m2aa0206[m HEAD@{664}: commit: Automated update Tue 05/27/2025 12:00:01.46
[33m86396b3[m HEAD@{665}: commit: Automated update Tue 05/27/2025 6:00:01.45
[33m9d40631[m HEAD@{666}: commit: Automated update Tue 05/27/2025 0:00:02.28
[33m6271506[m HEAD@{667}: commit: Automated update Mon 05/26/2025 18:00:01.45
[33m676f5ff[m HEAD@{668}: commit: Automated update Mon 05/26/2025 12:00:01.40
[33m85fdd64[m HEAD@{669}: commit: Automated update Mon 05/26/2025 6:00:01.40
[33ma8fe5e6[m HEAD@{670}: commit: Automated update Mon 05/26/2025 0:00:01.38
[33mb477ce7[m HEAD@{671}: commit: Automated update Sun 05/25/2025 18:00:01.37
[33mdede772[m HEAD@{672}: commit: Automated update Sun 05/25/2025 12:00:01.35
[33mc273559[m HEAD@{673}: commit: Automated update Sun 05/25/2025 6:00:01.31
[33m9aef5d9[m HEAD@{674}: commit: Automated update Sun 05/25/2025 0:00:01.65
[33m68e7f79[m HEAD@{675}: commit: Automated update Sat 05/24/2025 18:00:01.66
[33m057e957[m HEAD@{676}: commit: Automated update Sat 05/24/2025 12:00:01.96
[33maca3820[m HEAD@{677}: commit: Automated update Sat 05/24/2025 6:00:01.92
[33md31666b[m HEAD@{678}: commit: Automated update Sat 05/24/2025 0:00:01.94
[33m4cb4e3e[m HEAD@{679}: commit: Automated update Fri 05/23/2025 18:00:01.22
[33m2e42b3e[m HEAD@{680}: commit: Automated update Fri 05/23/2025 12:57:58.09
[33m2c20554[m HEAD@{681}: commit: Automated update Fri 05/23/2025 6:00:01.33
[33m07418fb[m HEAD@{682}: commit: Automated update Fri 05/23/2025 0:00:01.33
[33m47f2fc0[m HEAD@{683}: commit: Automated update Thu 05/22/2025 22:32:35.62
[33m6a24238[m HEAD@{684}: commit: Automated update Thu 05/22/2025 12:00:01.49
[33m966d496[m HEAD@{685}: commit: Automated update Thu 05/22/2025 6:00:01.47
[33me0ba0c0[m HEAD@{686}: commit: Automated update Thu 05/22/2025 0:00:01.46
[33m4660982[m HEAD@{687}: commit: Automated update Wed 05/21/2025 19:15:02.49
[33mfd94c6f[m HEAD@{688}: commit: Automated update Wed 05/21/2025 18:00:01.46
[33m9efa76f[m HEAD@{689}: commit: Automated update Wed 05/21/2025 12:00:01.44
[33m92f1c11[m HEAD@{690}: commit: Automated update Wed 05/21/2025 6:00:01.43
[33m9ab5bac[m HEAD@{691}: commit: Automated update Wed 05/21/2025 0:00:01.43
[33md821a83[m HEAD@{692}: commit: Automated update Tue 05/20/2025 18:00:01.41
[33me0581f2[m HEAD@{693}: commit: Automated update Tue 05/20/2025 12:00:01.39
[33m44f6875[m HEAD@{694}: commit: Automated update Tue 05/20/2025 6:00:01.38
[33mbad6e68[m HEAD@{695}: commit: Automated update Tue 05/20/2025 0:00:01.37
[33m4f3908d[m HEAD@{696}: commit: Automated update Mon 05/19/2025 18:00:01.35
[33m1450b91[m HEAD@{697}: commit: Automated update Mon 05/19/2025 12:00:01.34
[33m1686ade[m HEAD@{698}: commit: Automated update Mon 05/19/2025 6:00:01.42
[33m84bd00c[m HEAD@{699}: commit: Automated update Mon 05/19/2025 0:00:01.34
[33mc1dea7d[m HEAD@{700}: commit: Automated update Sun 05/18/2025 18:00:01.32
[33m94005a8[m HEAD@{701}: commit: Automated update Sun 05/18/2025 12:15:54.76
[33m1989443[m HEAD@{702}: commit: Automated update Sun 05/18/2025 12:00:01.32
[33m18b23a3[m HEAD@{703}: commit: Automated update Sun 05/18/2025 11:34:23.36
[33m46e2e14[m HEAD@{704}: commit: Automated update Sun 05/18/2025 11:21:13.33
[33m36a5252[m HEAD@{705}: commit: Automated update Sun 05/18/2025 11:05:11.76
[33m5f5d8b7[m HEAD@{706}: commit: Automated update Sun 05/18/2025 10:34:38.45
[33m57cc210[m HEAD@{707}: commit: Automated update Sun 05/18/2025 6:00:01.29
[33m412edeb[m HEAD@{708}: commit: Automated update Sun 05/18/2025 0:00:01.30
[33mb894b1c[m HEAD@{709}: commit: Automated update Sat 05/17/2025 20:17:54.82
[33m6c7e573[m HEAD@{710}: commit: Automated update Sat 05/17/2025 18:00:01.28
[33m14e0d39[m HEAD@{711}: commit: Automated update Sat 05/17/2025 17:45:47.19
[33m87e12f6[m HEAD@{712}: commit: Automated update Sat 05/17/2025 12:11:38.63
[33mf94c281[m HEAD@{713}: commit: Automated update Sat 05/17/2025 12:00:01.28
[33m059da58[m HEAD@{714}: commit: Automated update Sat 05/17/2025 6:00:01.28
[33m1c61a3b[m HEAD@{715}: commit: Automated update Sat 05/17/2025 0:00:01.26
[33m812102a[m HEAD@{716}: commit: Automated update Fri 05/16/2025 18:00:01.24
[33me94a704[m HEAD@{717}: commit: Automated update Fri 05/16/2025 12:00:01.23
[33m0abce62[m HEAD@{718}: commit: Automated update Fri 05/16/2025 9:20:38.18
[33m832f61d[m HEAD@{719}: commit: Automated update Fri 05/16/2025 7:14:52.10
[33mdaa3ae4[m HEAD@{720}: commit: Automated update Fri 05/16/2025 7:12:10.50
[33m9171334[m HEAD@{721}: commit: Automated update Fri 05/16/2025 0:00:01.22
[33mb622fb6[m HEAD@{722}: commit: Automated update Thu 05/15/2025 19:18:42.70
[33m3c79c45[m HEAD@{723}: commit: Automated update Thu 05/15/2025 18:00:01.20
[33m976f2b2[m HEAD@{724}: commit: Automated update Thu 05/15/2025 12:00:01.15
[33m6d09b35[m HEAD@{725}: commit: Automated update Thu 05/15/2025 6:00:01.14
[33m39057ad[m HEAD@{726}: commit: Automated update Thu 05/15/2025 0:00:01.12
[33mb7f962c[m HEAD@{727}: commit: Automated update Wed 05/14/2025 18:19:07.94
[33mf409007[m HEAD@{728}: commit: Automated update Wed 05/14/2025 18:00:02.06
[33m07e8221[m HEAD@{729}: commit: Automated update Wed 05/14/2025 12:00:02.04
[33m25fea48[m HEAD@{730}: commit: Automated update Wed 05/14/2025 0:00:01.27
[33mebcb529[m HEAD@{731}: commit: Automated update Tue 05/13/2025 18:51:49.03
[33m37b8fdf[m HEAD@{732}: commit: Automated update Tue 05/13/2025 18:51:31.33
[33m3d6381c[m HEAD@{733}: commit: Automated update Tue 05/13/2025 18:00:01.24
[33me46ad3f[m HEAD@{734}: commit: Automated update Tue 05/13/2025 12:00:01.24
[33m8740a51[m HEAD@{735}: commit: Automated update Tue 05/13/2025 6:00:01.22
[33m6419c1d[m HEAD@{736}: commit: Automated update Tue 05/13/2025 0:00:01.21
[33mf496cd6[m HEAD@{737}: commit: Automated update Mon 05/12/2025 18:00:01.17
[33mb17cfa0[m HEAD@{738}: commit: Automated update Mon 05/12/2025 15:45:19.09
[33m2a93982[m HEAD@{739}: commit: Automated update Mon 05/12/2025 15:43:21.48
[33m5c13566[m HEAD@{740}: commit: Automated update Mon 05/12/2025 15:42:39.47
[33m8e7d4a2[m HEAD@{741}: commit: Automated update Mon 05/12/2025 12:00:01.19
[33md776228[m HEAD@{742}: commit: Automated update Mon 05/12/2025 6:00:01.14
[33m48ec850[m HEAD@{743}: commit: Automated update Mon 05/12/2025 0:00:01.15
[33m37f9780[m HEAD@{744}: commit: Automated update Sun 05/11/2025 18:00:01.12
[33m7c3ccfd[m HEAD@{745}: commit: Automated update Sun 05/11/2025 16:05:51.77
[33m3021726[m HEAD@{746}: commit: Automated update Sun 05/11/2025 12:00:01.12
[33me799e6b[m HEAD@{747}: commit: Automated update Sun 05/11/2025 6:00:02.07
[33m5234a5c[m HEAD@{748}: commit: Automated update Sun 05/11/2025 0:00:02.06
[33m0ffedee[m HEAD@{749}: commit: Automated update Sat 05/10/2025 18:00:02.05
[33m7c0725e[m HEAD@{750}: commit: Automated update Sat 05/10/2025 13:51:06.68
[33m92006a5[m HEAD@{751}: commit: Automated update Sat 05/10/2025 12:00:02.04
[33mdb29a6d[m HEAD@{752}: commit: Automated update Sat 05/10/2025 6:00:02.00
[33mfcc1db5[m HEAD@{753}: commit: Automated update Sat 05/10/2025 0:00:01.98
[33m54c1389[m HEAD@{754}: commit: Automated update Fri 05/09/2025 18:00:02.00
[33m8643bfd[m HEAD@{755}: commit: Automated update Fri 05/09/2025 12:00:01.98
[33me504d46[m HEAD@{756}: commit: Automated update Fri 05/09/2025 8:01:22.44
[33mbefe944[m HEAD@{757}: commit: Automated update Fri 05/09/2025 6:00:01.96
[33m365cced[m HEAD@{758}: commit: Automated update Fri 05/09/2025 0:00:01.95
[33m90c6fe6[m HEAD@{759}: commit: Automated update Thu 05/08/2025 19:12:22.33
[33m233d46d[m HEAD@{760}: commit: Automated update Thu 05/08/2025 18:00:01.94
[33m03d90f3[m HEAD@{761}: commit: Automated update Thu 05/08/2025 12:00:01.93
[33mc6c49fa[m HEAD@{762}: commit: Changes to contact info
[33m7d52613[m HEAD@{763}: commit: Automated update Thu 05/08/2025 6:33:16.02
[33m5044a3b[m HEAD@{764}: commit: Automated update Thu 05/08/2025 6:00:01.92
[33m2e1c170[m HEAD@{765}: commit: Automated update Thu 05/08/2025 0:00:01.92
[33m27082b4[m HEAD@{766}: commit: Automated update Wed 05/07/2025 18:00:01.90
[33m6c78da0[m HEAD@{767}: commit: Automated update Wed 05/07/2025 15:57:48.88
[33mdef2321[m HEAD@{768}: commit: Automated update Wed 05/07/2025 15:55:36.64
[33me21fc29[m HEAD@{769}: commit: Automated update Wed 05/07/2025 15:36:26.27
[33mebf546f[m HEAD@{770}: commit: Automated update Wed 05/07/2025 14:41:44.63
[33m038ff05[m HEAD@{771}: commit: Automated update Wed 05/07/2025 12:00:01.89
[33m11f1fad[m HEAD@{772}: commit: Automated update Wed 05/07/2025 6:00:01.85
[33mddb5cc2[m HEAD@{773}: commit: Automated update Wed 05/07/2025 0:00:01.85
[33mca9793f[m HEAD@{774}: commit: Automated update Tue 05/06/2025 18:00:01.85
[33m2199e62[m HEAD@{775}: commit: Automated update Tue 05/06/2025 12:00:01.83
[33md25086a[m HEAD@{776}: commit: Automated update Tue 05/06/2025 6:00:01.81
[33mb11d9bc[m HEAD@{777}: commit: Automated update Tue 05/06/2025 0:00:01.81
[33mbd86b87[m HEAD@{778}: commit: Automated update Mon 05/05/2025 18:00:01.76
[33mb20cb37[m HEAD@{779}: commit: Automated update Mon 05/05/2025 12:00:01.73
[33m4d453e2[m HEAD@{780}: commit: Automated update Mon 05/05/2025 11:11:09.97
[33mb72e90f[m HEAD@{781}: commit: Automated update Mon 05/05/2025 11:06:10.36
[33m58d61d2[m HEAD@{782}: commit: Automated update Mon 05/05/2025 10:59:33.05
[33m144249d[m HEAD@{783}: commit: Automated update Mon 05/05/2025 10:56:30.79
[33m3a20844[m HEAD@{784}: commit: Automated update Mon 05/05/2025 10:44:33.22
[33m4c83501[m HEAD@{785}: commit: Automated update Mon 05/05/2025 10:38:03.90
[33mbcb6425[m HEAD@{786}: commit: Automated update Mon 05/05/2025 6:00:01.73
[33ma639930[m HEAD@{787}: commit: Automated update Mon 05/05/2025 0:00:01.72
[33me95d626[m HEAD@{788}: commit: Automated update Sun 05/04/2025 18:00:01.73
[33m38cad5f[m HEAD@{789}: commit: Changes to Elessar logos across details pane, About, and favicon icon
[33m6002777[m HEAD@{790}: commit: Changes to Elessar logos across details pane, About, and favicon icon
[33m7786d62[m HEAD@{791}: commit: Automated update Sun 05/04/2025 12:00:01.71
[33m87b6c5d[m HEAD@{792}: commit: Automated update Sun 05/04/2025 6:00:01.67
[33ma8e9a30[m HEAD@{793}: commit: Automated update Sun 05/04/2025 0:00:01.64
[33mebc2c75[m HEAD@{794}: commit: Automated update Sat 05/03/2025 18:00:01.66
[33m2ec60a8[m HEAD@{795}: commit: Automated update Sat 05/03/2025 17:48:55.98
[33mefee251[m HEAD@{796}: commit: Automated update Sat 05/03/2025 17:39:00.04
[33m01e8e16[m HEAD@{797}: commit: Automated update Sat 05/03/2025 12:00:01.59
[33m7c84096[m HEAD@{798}: commit: Automated update Sat 05/03/2025 6:00:01.56
[33m02c7e91[m HEAD@{799}: commit: Automated update Sat 05/03/2025 0:00:01.54
[33m7f11d21[m HEAD@{800}: commit: Automated update Fri 05/02/2025 18:00:04.10
[33m8b6bbb8[m HEAD@{801}: commit: Automated update Fri 05/02/2025 12:00:01.53
[33mb29ffde[m HEAD@{802}: commit: Automated update Fri 05/02/2025 6:00:01.54
[33md63c826[m HEAD@{803}: commit: Automated update Fri 05/02/2025 0:00:01.52
[33m905b527[m HEAD@{804}: commit: Automated update Thu 05/01/2025 18:11:53.57
[33m6399124[m HEAD@{805}: commit: Automated update Thu 05/01/2025 18:00:01.48
[33m7d62d73[m HEAD@{806}: commit: Automated update Thu 05/01/2025 12:00:01.48
[33mf828bc8[m HEAD@{807}: commit: Automated update Thu 05/01/2025 10:11:22.48
[33m7334f85[m HEAD@{808}: commit: Automated update Thu 05/01/2025 6:00:01.47
[33m1d4c05c[m HEAD@{809}: commit: Automated update Thu 05/01/2025 0:00:01.47
[33m4aaa222[m HEAD@{810}: commit: Automated update Wed 04/30/2025 18:00:01.46
[33m139cae1[m HEAD@{811}: commit: Automated update Mon 04/28/2025 18:00:10.37
[33m87f02e7[m HEAD@{812}: commit: Automated update Wed 04/30/2025 12:00:01.47
[33ma51a931[m HEAD@{813}: commit: Automated update Wed 04/30/2025 8:52:42.11
[33mc5a96ff[m HEAD@{814}: commit: Automated update Wed 04/30/2025 8:32:53.34
[33m99198ff[m HEAD@{815}: commit: Automated update Wed 04/30/2025 7:38:02.58
[33m85a6644[m HEAD@{816}: commit: Automated update Wed 04/30/2025 6:00:01.45
[33m0c5aade[m HEAD@{817}: commit: Automated update Wed 04/30/2025 0:00:01.44
[33me5501ef[m HEAD@{818}: commit: Automated update Tue 04/29/2025 18:00:01.42
[33m6d0b61b[m HEAD@{819}: commit: Automated update Tue 04/29/2025 16:21:42.75
[33m185595b[m HEAD@{820}: commit: Automated update Tue 04/29/2025 16:11:44.66
[33m540f47c[m HEAD@{821}: merge origin/main: Merge made by the 'ort' strategy.
[33m37ebbab[m HEAD@{822}: commit (amend): Automated update Mon 04/28/2025 18:00:10.37
[33mdb5d10b[m HEAD@{823}: commit (amend): Automated update Mon 04/28/2025 18:00:10.37
[33m9099829[m HEAD@{824}: commit (amend): Automated update Mon 04/28/2025 18:00:10.37
[33m09bd233[m HEAD@{825}: commit: Automated update Mon 04/28/2025 18:00:10.37
[33m0a50019[m HEAD@{826}: commit: Automated update Mon 04/28/2025 0:00:13.33
[33m8090795[m HEAD@{827}: commit (amend): Fixing an out of sync record due to SQL error. Fixed error and manually uploaded
[33m53d051a[m HEAD@{828}: commit: Fixing an out of sync record due to SQL error. Fixed error and manually uploaded
[33md19d516[m HEAD@{829}: rebase (finish): returning to refs/heads/main
[33md19d516[m HEAD@{830}: rebase (pick): Fixing an out of sync record due to SQL error. Fixed error and manually uploaded
[33mf4eceeb[m HEAD@{831}: rebase (pick): Fixing an out of sync record due to SQL error. Fixed error and manually uploaded
[33mc88e4d7[m HEAD@{832}: rebase (start): checkout origin/main
[33m6903d40[m HEAD@{833}: commit (amend): Fixing an out of sync record due to SQL error. Fixed error and manually uploaded
[33m7bf42e1[m HEAD@{834}: commit: Fixing an out of sync record due to SQL error. Fixed error and manually uploaded
[33m8369741[m HEAD@{835}: commit: Fixing an out of sync record due to SQL error. Fixed error and manually uploaded
[33m0613af8[m HEAD@{836}: commit (amend): Fixing an out of sync record due to SQL error. Fixed error and manually uploaded
[33mc88e4d7[m HEAD@{837}: commit: Fixing an out of sync record due to SQL error. Fixed error and manually uploaded
[33m1f5b41a[m HEAD@{838}: commit: Automated update Sun 04/27/2025 18:00:10.98
[33mbda544e[m HEAD@{839}: commit: Fix .gitignore to ignore all .bat files
[33m5daf242[m HEAD@{840}: commit: 🔒 Swap in production Mapbox token
[33mf2e3a9a[m HEAD@{841}: reset: moving to origin/main
[33m4c77a72[m HEAD@{842}: commit: 🔒 Swap in production Mapbox token
[33m7d8a009[m HEAD@{843}: commit: Remove file from repository
[33m36c7ce0[m HEAD@{844}: commit: Remove local .bat file from repository
[33mc69b060[m HEAD@{845}: commit: Remove log files from repo
[33m1162c33[m HEAD@{846}: commit (merge): Fixed .gitignore merge conflict
[33m6b16f3d[m HEAD@{847}: Branch: renamed refs/heads/master to refs/heads/main
[33m6b16f3d[m HEAD@{849}: commit: First public version of UAP site
[33mcb774e6[m HEAD@{850}: commit (initial): First public version of Elessar site
